doc_id,problem_status,problem_summary,solutions_count,solutions_status,implementation_status,implementation_count,narrative_hook_present,narrative_hook_type,problem_explicitly_labelled,solutions_explicitly_labelled,implementation_explicitly_labelled,procedural_clarity_status
green4c,present,"Negative changes in environmental conditions affect human health and well-being, leading to increased social inequalities and health issues, necessitating intervention through nature-based solutions.",5,present,weak,0,True,statistic,True,True,False,weak
globis-b,present,"The document identifies the need for effective operationalization of Essential Biodiversity Variables (EBVs) for biodiversity assessments, highlighting challenges in data integration, legal restrictions, and the need for policy support.",8,present,weak,0,True,case study,True,True,False,weak
greengain_1,present,"The document identifies problems related to the utilization of biomass from landscape conservation and maintenance work (LCMW) for energy production, including legal regulations, financial tools, public participation, and governance issues.",4,present,present,5,True,case study,True,True,True,present
greengain_2,present,"The document identifies the lack of clear definitions and regulations for biomass from landscape conservation and maintenance work (LCMW), which hinders its market uptake and effective management.",14,present,weak,0,True,provocative question,True,True,False,weak
greengain_3,present,"The document identifies the challenge of increasing the energy use of biomass feedstock from landscape conservation and maintenance works, highlighting the need for effective management and utilization of biomass resources.",10,present,present,4,True,case study,True,True,True,present
holisoils_2,present,"The document identifies a lack of comprehensive and reliable soil information across the EU, particularly regarding forest soils, which hinders the effective implementation of the EU Soil Monitoring Law.",3,present,weak,0,True,statistic,True,True,False,weak
holisoils_1,present,"Soil degradation threatens sustainable provisioning of ecosystem services essential for human wellbeing, driven by unsustainable forest management, peatland drainage, and other factors, leading to significant economic costs in the EU.",6,present,weak,0,True,statistic,True,True,False,weak
holisoils_3,present,The document identifies the challenge of increasing carbon sequestration in forest soils and reducing greenhouse gas emissions to meet climate neutrality targets set by the European Union.,5,present,weak,0,True,statistic,True,True,False,weak
incredible_1,absent,,12,present,weak,0,False,,False,True,False,weak
impetus,present,"The document identifies challenges related to climate adaptation (CA) financing and policy barriers, emphasizing the need for effective decision-making and collaboration among stakeholders to address these issues.",5,present,weak,2,True,case study,True,True,False,weak
incredible_2,present,"The document identifies challenges related to the underutilization and potential of non-wood forest products (NWFP) in Europe, emphasizing their importance for sustainable development and economic growth.",12,present,weak,0,True,case study,True,True,False,weak
integral_1,present,"The document identifies the challenge of balancing competing forest land uses and societal demands on forest ecosystem goods and services, highlighting incoherence in EU and national forest policies and the need for integrated forest management.",3,present,weak,0,True,provocative question,True,True,False,absent
integral_2,present,"The document identifies the challenge of sustainable forest management (SFM) in Europe, emphasizing the need for integrated and future-oriented management strategies to address long-term uncertainties and societal demands.",3,present,weak,0,True,statistic,True,True,False,weak
locomotion_1,present,"The document identifies the urgent need for a transition to a climate-neutral Europe due to the global climate emergency and geopolitical challenges, particularly in light of the war in Ukraine and the need for sustainable energy supplies.",12,present,weak,0,True,provocative statement,True,True,False,weak
locomotion_2,present,"The document identifies challenges related to the land requirements for renewable energy infrastructure, the low energy return on investment (EROI) of renewables under green growth, the sustainability of electric vehicle adoption, and the inequalities exacerbated by green growth policies.",15,present,weak,0,True,statistic,True,True,False,weak
innoforest,present,"The document identifies challenges in the balanced provision of forest ecosystem services (FES) due to global environmental issues, urbanization, and market dynamics, which hinder forest owners from generating revenue from these services.",6,present,weak,0,True,statistic,True,True,False,weak
magic_2,present,"The document identifies challenges related to land marginality, including biophysical and environmental issues that hinder agricultural productivity and the cultivation of industrial crops.",2,present,present,5,True,case study,True,True,True,present
magic_1,present,"The document identifies challenges related to the restoration of marginal land and the cultivation of industrial crops, emphasizing the need for government intervention to address these issues.",7,present,weak,0,True,statistic,True,True,False,weak
merlin,present,The document identifies the degradation of freshwater ecosystems due to agricultural practices and the need for restoration to support water resilience and agricultural productivity.,6,present,weak,3,True,statistic,True,True,False,weak
motive_1,present,"Climate change is affecting European forests, leading to increased growth rates in some areas and declines in others, along with increased abiotic and biotic disturbances.",6,present,weak,0,True,provocative statement,True,True,False,weak
motive_2,present,"Climate change is projected to significantly impact European forests, affecting tree growth, species choice, and increasing risks from disturbances such as wind, fire, and pests.",3,present,weak,0,True,statistic,True,True,False,weak
naiad_1,present,"The document identifies the need for improved investment in Nature Based Solutions (NBS) to reduce risks associated with climate change, particularly in the context of increasing flooding and droughts, which threaten insurance markets and disaster resilience.",3,present,weak,0,True,statistic,True,True,False,weak
naiad_2,present,"The document identifies the need for better engagement of the insurance sector in disaster risk reduction (DRR), Nature Based Solutions (NBS), and climate adaptation, highlighting the challenges and opportunities in this area.",10,present,weak,0,True,opportunity areas and recommendations,True,True,False,weak
newforex,present,"Mediterranean forests are among the most vulnerable ecosystems, facing degradation and desertification due to harsh climatic conditions, human pressures, and recurrent fires, necessitating intervention through innovative financial mechanisms like Payments for Environmental Services (PES).",6,present,weak,0,True,statistic,True,True,False,weak
naiad_3,present,"The document identifies challenges in financing and implementing nature-based solutions (NBS) for climate change adaptation and disaster risk management, highlighting the need for better integration of these solutions into existing policies and practices.",4,present,weak,0,True,case study,True,True,False,weak
oneforest,present,"Forests face significant challenges due to climate change, including disturbances like fire, storms, pests, and drought, which make ecosystems vulnerable and complicate forest management.",3,present,weak,0,True,statistic,False,True,False,weak
oasis,present,"The document identifies challenges related to the accessibility and usability of catastrophe models for non-insurance entities, particularly in the context of climate change and its impact on risk assessment.",2,present,present,3,True,vivid example,True,True,True,present
optfor-eu,present,"The sustainability of forest services is threatened by various pressures, particularly climate-related challenges, as highlighted by habitat assessments and stakeholder feedback.",6,present,weak,0,True,statistic,False,True,False,weak
pegasus,present,"The document identifies limitations in the current policy response to delivering environmental and social benefits from EU agricultural and forestry land, highlighting insufficient use of existing regulations and CAP incentives to achieve desired outcomes.",7,present,weak,0,True,case study,True,True,False,weak
phusicos_1,present,"Insufficient funding, unbalanced distribution of funding for green and grey measures, and investments in nature-negative projects hinder the implementation of nature-based solutions (NBS).",4,present,weak,0,True,case study,True,True,False,weak
phusicos_2,present,"The document identifies barriers to the implementation of nature-based solutions (NBS), particularly in disaster risk reduction, including lack of knowledge, qualified contractors, and funding issues.",6,present,weak,0,True,case study,True,True,False,weak
ponderful_1,present,The document identifies the need for effective management and protection of ponds and pondscapes as nature-based solutions to address climate change and other societal challenges.,6,present,weak,2,True,case study,True,True,False,weak
ponderful_2,present,"Ponds are critically important yet often overlooked freshwater habitats that provide essential ecosystem services and support biodiversity, but they lack sufficient scientific attention and policy recognition.",6,present,present,3,True,statistic,True,True,True,present
resalliance_1,present,"The document identifies the challenge of enhancing landscape resilience to address the well-being of a growing global population, climate change, and biodiversity loss.",0,absent,absent,0,True,provocative question,True,False,False,absent
provide,present,"The document identifies the need to improve governance mechanisms for the provision of public goods by agriculture and forestry, highlighting weaknesses in current systems and the necessity for optimized financial incentives and participatory approaches.",9,present,weak,0,True,case study,True,True,False,weak
resalliance_2,present,The document identifies the need for innovative landscape resilience solutions in agriculture and forestry due to challenges posed by climate change and land use changes in the Mediterranean basin.,12,present,weak,0,True,definition of landscape resilience,True,True,False,weak
resonate_1,present,"Climate change is causing increased disturbances in forests, leading to economic losses for forest owners and instability in the wood market, particularly affecting small-scale forest owners and the wood processing industry.",8,present,weak,0,True,statistic,False,True,False,weak
resonate_2,present,"Bark beetle outbreaks have devastated European forests, causing significant socio-economic issues and raising concerns about climate targets and forest management practices.",8,present,weak,0,True,statistic,False,True,False,weak
resonate_4,present,"Increasing frequency and severity of climate-driven disturbances are threatening Europe's forests, necessitating effective adaptation measures.",3,present,present,3,True,statistic,True,True,True,present
resonate_5,present,"Forests are under pressure from climate change and disturbances, affecting their health and resilience, which biodiversity can help mitigate.",10,present,weak,0,True,statistic,False,True,False,weak
resonate_6,present,"European forests face increasing challenges from extreme climatic events and disturbances, necessitating a stronger focus on forest resilience to support sustainable forest management.",3,present,weak,0,True,case study,False,False,False,weak
resonate_7,present,"Increased disturbances due to climate change are negatively impacting forest biodiversity, affecting species that depend on old and dense forests while benefiting those that thrive in younger, more open environments.",9,present,weak,0,True,statistic,False,True,False,weak
resonate_8,present,"Significant increase in forest disturbances since the 1950s, leading to ecosystem degradation, tree mortality, and challenges in achieving EU climate targets.",1,present,weak,0,True,statistic,False,False,False,absent
resonate_3,present,"Climate change is a long-term challenge affecting forest ecosystems and forest-based value chains, necessitating solutions for adapting forests to increasing disturbances and ecosystemic shifts.",3,present,weak,0,True,quote,False,True,False,absent
rosewood40,weak,The document implies challenges in digitalization within the forest industry but does not explicitly frame a specific policy problem.,4,present,weak,0,True,abstract,False,True,False,weak
safers,present,"The document identifies challenges in forest fire emergency management, particularly the underutilization of geospatial data and the need for improved resilience in societies facing forest fire threats.",9,present,weak,0,True,case study,True,True,False,weak
silvanus_1,present,"The document identifies challenges related to forest management, including the need for sustainable practices, resilience to climate change, and effective wildfire prevention and mitigation policies.",3,present,weak,0,True,case study,True,True,False,weak
silvanus_2,present,"The document identifies challenges in deforestation, climate adaptation, and biodiversity conservation within the context of forest governance in the EU, necessitating a multi-level governance approach.",4,present,weak,0,True,statistic,True,True,False,weak
simra_1,present,"Rural communities face challenges such as constrained accessibility, poor-quality land, and weak local economies, which hinder their resilience and innovation, necessitating intervention through social innovation.",5,present,weak,0,True,statistic,True,True,False,weak
sim4nexus,present,"The document identifies challenges related to climate change, resource management, and the need for integrated approaches to water, land, food, energy, and climate systems in Europe.",6,present,weak,0,True,case study,True,True,False,weak
simra_2,present,"The document identifies the challenge of raising the profile of social innovation in policy making, particularly in marginalised rural areas, and highlights the need for supportive policies to enhance the impact of social innovation.",9,present,weak,0,True,quote,False,True,False,weak
simwood,present,"The document identifies the challenge of under-utilisation of wood resources in European forests, emphasizing the need for increased wood mobilisation to meet growing demand and support sustainable forest management.",17,present,present,17,True,statistic,True,True,True,present
sincere_2,present,"PES implementation in Europe is limited by insufficient private willingness to pay, design flaws, and institutional challenges, despite the potential benefits of PES as effective environmental instruments.",3,present,weak,0,True,provocative questions,False,True,False,weak
sincere_1,present,"The document identifies challenges in aligning the supply and demand of forest ecosystem services (FES) in Europe, highlighting issues such as insufficient policy integration, lack of political support, and the need to adapt to climate change.",4,present,weak,0,True,statistic,True,True,False,weak
startree_1,present,"The document identifies challenges related to the harvesting and management of non-wood forest products (NWFPs), emphasizing the need for effective policies to support rural development and sustainable resource use.",12,present,weak,0,True,case study,True,True,False,weak
startree_2,present,"The document identifies the underutilization of non-wood forest products (NWFPs) in Europe, highlighting the need for better management and integration of NWFPs into forest policies to unlock their economic potential.",3,present,weak,0,True,statistic,True,True,False,weak
superb_1,present,"Europe's forests are under pressure from climate change, land-use changes, and increasing demand for forest products, which affects their ability to provide ecosystem services and biodiversity.",4,present,weak,0,True,statistic,False,True,False,weak
smartli,present,"The document identifies the need for sustainable bio-based products due to the scarcity of non-renewable resources, climate change, and a growing world population, framing it as a challenge that requires strategies for sustainable development and market diffusion of lignin-based products.",2,present,weak,0,True,statistic,True,True,False,weak
superb_3,present,"Biodiversity is in long-term decline, with a significant funding gap limiting efforts to reverse this trend, and the emerging biodiversity credit market risks replicating flaws seen in carbon markets.",7,present,weak,0,True,statistic,True,True,False,weak
superb_2,present,"The document identifies the urgent need for consistent environmental policies in the face of economic crises, highlighting the tendency to deprioritize environmental concerns during such times, which leads to long-term costs and damages.",3,present,weak,0,True,provocative question,True,True,False,weak
superb_4,present,"Climate change is threatening European forests' biodiversity and ecosystem services, with a projected decline in the forest carbon sink by 30-40% by 2061-2080 due to maladaptation of local tree species and habitat fragmentation.",5,present,weak,0,True,statistic,True,True,False,weak
terranova_1,present,The document identifies the biodiversity crisis and the need for improved land management in Europe as urgent challenges that require intervention.,2,present,weak,0,True,provocative question,False,True,False,absent
terranova_2,present,"Intensified human activities have led to climate change, ecosystem degradation, and reduced biodiversity, necessitating effective solutions for sustainable landscape management.",4,present,weak,0,True,statistic,True,True,False,weak
terranova_3,present,"The document identifies challenges related to reduced biodiversity and climate change, emphasizing the need for strategic restoration actions in European landscapes.",3,present,weak,0,True,statistic,True,True,False,weak
woodcircus,present,"The construction sector in Europe generates approximately 70.5 million tons of wood waste annually, with only about one third being reused or recycled, indicating a significant waste management issue that requires intervention.",6,present,weak,0,True,statistic,True,True,False,weak
unravel,present,The document identifies the challenge of transitioning to sustainable lignocellulosic biorefineries and the need for policy support to integrate these technologies into European strategies for climate change mitigation.,7,present,weak,0,True,statistic,True,True,False,weak
